### ISSUE TITLE
Official websocket sample program not working

### ISSUE THREAD

**Issue by pluveto** [nestjs/nest#11489]
### Is there an existing issue for this?

- [X] I have searched the existing issues

### Current behavior

Server started successfully, but not connectable

<img width="1137" alt="image" src="https://user-images.githubusercontent.com/50045289/232198044-f357a9b7-ddef-4485-8925-a1697b8b5799.png">

<img width="415" alt="image" src="https://user-images.githubusercontent.com/50045289/232197565-625b87c4-c57a-4884-aa66-9c7252ed1f70.png">

Port and TCP connection is OK

```shell
$ lsof -i :3000
COMMAND     PID        USER   FD   TYPE             DEVICE SIZE/OFF NODE NAME
node      18157 ****   23u  IPv6 0x9f23666ea9f6ab2f      0t0  TCP *:hbci (LISTEN)
```

```shell
$ telnet localhost 3000
Trying ::1...
Connected to localhost.
Escape character is '^]'.
^CConnection closed by foreign host.
```

TCP dump:

```shell
$ sudo tcpdump -i any port 3000 -vvv -s0 -w websocket.pcap
$ tshark -r websocket.pcap
    1   0.000000          ::1 → ::1          TCP 88 62578 → 3000 [SYN] Seq=0 Win=65535 Len=0 MSS=16324 WS=64 TSval=174353438 TSecr=0 SACK_PERM
    2   0.000024          ::1 → ::1          TCP 88 [TCP Retransmission] [TCP Port numbers reused] 62578 → 3000 [SYN] Seq=0 Win=65535 Len=0 MSS=16324 WS=64 TSval=174353438 TSecr=0 SACK_PERM
    3   0.000235          ::1 → ::1          TCP 88 3000 → 62578 [SYN, ACK] Seq=0 Ack=1 Win=65535 Len=0 MSS=16324 WS=64 TSval=196498707 TSecr=174353438 SACK_PERM
    4   0.000247          ::1 → ::1          TCP 88 [TCP Retransmission] 3000 → 62578 [SYN, ACK] Seq=0 Ack=1 Win=65535 Len=0 MSS=16324 WS=64 TSval=196498707 TSecr=174353438 SACK_PERM
    5   0.000273          ::1 → ::1          TCP 76 62578 → 3000 [ACK] Seq=1 Ack=1 Win=407744 Len=0 TSval=174353438 TSecr=196498707
    6   0.000277          ::1 → ::1          TCP 76 [TCP Dup ACK 5#1] 62578 → 3000 [ACK] Seq=1 Ack=1 Win=407744 Len=0 TSval=174353438 TSecr=196498707
    7   0.000301          ::1 → ::1          TCP 76 [TCP Window Update] 3000 → 62578 [ACK] Seq=1 Ack=1 Win=407744 Len=0 TSval=196498707 TSecr=174353438
    8   0.000306          ::1 → ::1          TCP 76 [TCP Dup ACK 3#1] 3000 → 62578 [ACK] Seq=1 Ack=1 Win=407744 Len=0 TSval=196498707 TSecr=174353438
    9   0.000361          ::1 → ::1          HTTP 603 GET / HTTP/1.1
   10   0.000391          ::1 → ::1          TCP 603 [TCP Retransmission] 62578 → 3000 [PSH, ACK] Seq=1 Ack=1 Win=407744 Len=527 TSval=174353438 TSecr=196498707
   11   0.000408          ::1 → ::1          TCP 76 3000 → 62578 [ACK] Seq=1 Ack=528 Win=407232 Len=0 TSval=196498707 TSecr=174353438
   12   0.000413          ::1 → ::1          TCP 76 [TCP Dup ACK 11#1] 3000 → 62578 [ACK] Seq=1 Ack=528 Win=407232 Len=0 TSval=196498707 TSecr=174353438
   13   1.003674          ::1 → ::1          TCP 76 3000 → 62578 [FIN, ACK] Seq=1 Ack=528 Win=407232 Len=0 TSval=196499710 TSecr=174353438
   14   1.003684          ::1 → ::1          TCP 76 [TCP Retransmission] 3000 → 62578 [FIN, ACK] Seq=1 Ack=528 Win=407232 Len=0 TSval=196499710 TSecr=174353438
   15   1.003698          ::1 → ::1          TCP 76 62578 → 3000 [ACK] Seq=528 Ack=2 Win=407744 Len=0 TSval=174354441 TSecr=196499710
   16   1.003701          ::1 → ::1          TCP 76 [TCP Dup ACK 15#1] 62578 → 3000 [ACK] Seq=528 Ack=2 Win=407744 Len=0 TSval=174354441 TSecr=196499710
   17   1.003855          ::1 → ::1          TCP 76 62578 → 3000 [FIN, ACK] Seq=528 Ack=2 Win=407744 Len=0 TSval=174354441 TSecr=196499710
   18   1.003861          ::1 → ::1          TCP 76 [TCP Retransmission] 62578 → 3000 [FIN, ACK] Seq=528 Ack=2 Win=407744 Len=0 TSval=174354441 TSecr=196499710
   19   1.003885          ::1 → ::1          TCP 76 3000 → 62578 [ACK] Seq=2 Ack=529 Win=407232 Len=0 TSval=196499710 TSecr=174354441
   20   1.003888          ::1 → ::1          TCP 76 [TCP Dup ACK 19#1] 3000 → 62578 [ACK] Seq=2 Ack=529 Win=407232 Len=0 TSval=196499710 TSecr=17435444
```

### Minimum reproduction code

<https://github.com/nestjs/nest/tree/master/sample/02-gateways>

### Steps to reproduce

1. run `yarn`
2. run `yarn start:dev`
3. open any browser (tested in Chrome, Edge and Safari)
4. execute `const ws = new WebSocket('ws://localhost:3000');`

### Expected behavior

Should be connectable

### Package

- [ ] I don't know. Or some 3rd-party package
- [X] <code>@nestjs/common</code>
- [ ] <code>@nestjs/core</code>
- [ ] <code>@nestjs/microservices</code>
- [ ] <code>@nestjs/platform-express</code>
- [ ] <code>@nestjs/platform-fastify</code>
- [x] <code>@nestjs/platform-socket.io</code>
- [ ] <code>@nestjs/platform-ws</code>
- [ ] <code>@nestjs/testing</code>
- [ ] <code>@nestjs/websockets</code>
- [ ] Other (see below)

### NestJS version

9.3.12

### Packages versions

```json
{
  "name": "nest-typescript-starter",
  "version": "1.0.0",
  "description": "Nest TypeScript starter repository",
  "license": "MIT",
  "scripts": {
    "prebuild": "rimraf dist",
    "build": "nest build",
    "format": "prettier --write \"src/**/*.ts\" \"test/**/*.ts\"",
    "start": "nest start",
    "start:dev": "nest start --watch",
    "start:debug": "nest start --debug --watch",
    "start:prod": "node dist/main",
    "lint": "eslint '{src,apps,libs,test}/**/*.ts' --fix",
    "test": "jest",
    "test:watch": "jest --watch",
    "test:cov": "jest --coverage",
    "test:debug": "node --inspect-brk -r tsconfig-paths/register -r ts-node/register node_modules/.bin/jest --runInBand",
    "test:e2e": "jest --config ./e2e/jest-e2e.json"
  },
  "dependencies": {
    "@nestjs/common": "9.3.12",
    "@nestjs/core": "9.3.12",
    "@nestjs/platform-express": "9.3.12",
    "@nestjs/platform-socket.io": "9.3.12",
    "@nestjs/websockets": "9.3.12",
    "@socket.io/redis-adapter": "7.2.0",
    "class-transformer": "0.5.1",
    "class-validator": "0.14.0",
    "reflect-metadata": "0.1.13",
    "rimraf": "4.4.1",
    "rxjs": "7.5.5",
    "socket.io": "4.6.1",
    "socket.io-client": "^4.6.1"
  },
  "devDependencies": {
    "@nestjs/cli": "9.0.0",
    "@nestjs/schematics": "9.0.4",
    "@nestjs/testing": "9.3.12",
    "@types/express": "4.17.13",
    "@types/jest": "28.1.4",
    "@types/node": "18.0.3",
    "@types/supertest": "2.0.12",
    "@types/ws": "8.5.3",
    "@typescript-eslint/eslint-plugin": "5.56.0",
    "@typescript-eslint/parser": "5.56.0",
    "eslint": "8.19.0",
    "eslint-config-prettier": "8.8.0",
    "eslint-plugin-import": "2.26.0",
    "jest": "28.1.2",
    "prettier": "2.7.1",
    "redis": "4.6.5",
    "supertest": "6.2.4",
    "ts-jest": "28.0.8",
    "ts-loader": "9.3.1",
    "ts-node": "10.8.2",
    "tsconfig-paths": "4.0.0",
    "typescript": "4.9.5"
  },
  "jest": {
    "moduleFileExtensions": [
      "js",
      "json",
      "ts"
    ],
    "rootDir": "src",
    "testRegex": ".*\\.spec\\.ts$",
    "transform": {
      "^.+\\.(t|j)s$": "ts-jest"
    },
    "collectCoverageFrom": [
      "**/*.(t|j)s"
    ],
    "coverageDirectory": "../coverage",
    "testEnvironment": "node"
  }
}

```

### Node.js version

18.15.0

### In which operating systems have you tested?

- [X] macOS
- [ ] Windows
- [ ] Linux

**Comment by jmcdo29** [comment]
The reproduction you've provided uses `socket.io` which does not directly integrate with `websockets`, it needs to use a `socket.io-client` instance to connect. 

Please use our [Discord](https://discord.gg/nestjs) channel (Support). We are using GitHub to track Bug Reports, Feature Requests, and Regressions.
